{
  "format": "memcoach.portable",
  "version": 1,
  "exported_at": "2026-07-15T00:00:00Z",
  "source": {
    "app": "memcoach-web",
    "app_version": "0.1.0",
    "installation_id": "aaaaaaaa-aaaa-4aaa-8aaa-aaaaaaaaaaaa",
    "platform": "web"
  },
  "scope": "library",
  "counts": {
    "kids": 1,
    "decks": 1,
    "cards": 1,
    "progress": 1,
    "reviews": 1
  },
  "library": {
    "kids": [
      {
        "portable_id": "11111111-1111-4111-8111-111111111111",
        "name": "Fixture Kid",
        "updated_at": "2026-07-15T00:00:00Z"
      }
    ],
    "decks": [
      {
        "portable_id": "22222222-2222-4222-8222-222222222222",
        "name": "Fixture Deck",
        "updated_at": "2026-07-15T00:00:00Z"
      }
    ],
    "cards": [
      {
        "portable_id": "33333333-3333-4333-8333-333333333333",
        "deck_portable_id": "22222222-2222-4222-8222-222222222222",
        "prompt": "Fixture prompt",
        "full_text": "Fixture answer",
        "updated_at": "2026-07-15T00:00:00Z"
      }
    ],
    "progress": [
      {
        "portable_id": "44444444-4444-4444-8444-444444444444",
        "kid_portable_id": "11111111-1111-4111-8111-111111111111",
        "card_portable_id": "33333333-3333-4333-8333-333333333333",
        "interval_days": 6,
        "due_date": "2026-07-21",
        "ease_factor": "2.500000",
        "streak": 1,
        "last_review": "2026-07-15T00:00:00Z"
      }
    ],
    "reviews": [
      {
        "portable_id": "55555555-5555-4555-8555-555555555555",
        "card_portable_id": "33333333-3333-4333-8333-333333333333",
        "kid_portable_id": "11111111-1111-4111-8111-111111111111",
        "grade": "perfect",
        "user_text": "Fixture answer",
        "duration_seconds": 12,
        "ts": "2026-07-15T00:00:00Z"
      }
    ]
  },
  "integrity": {
    "alg": "sha256",
    "sha256": "d99858d0a8f537b440db80cd3f07665e874a0c3bffab2cb7162405a82c6029c7"
  }
}
